ID	ParentID	SchemaID	Name	LongName	Description
526	513	1	Masked	Property/Data-property/Data-value/Categorical-value/Categorical-judgment-value/Masked	Information exists but is not provided or is partially obscured due to security,  privacy, or other concerns.
527	513	1	Normal	Property/Data-property/Data-value/Categorical-value/Categorical-judgment-value/Normal	Being approximately average or within certain limits. Conforming with or constituting a norm or standard or level or type or social norm.
528	513	1	Ordered	Property/Data-property/Data-value/Categorical-value/Categorical-judgment-value/Ordered	Conforming to a logical or comprehensible arrangement of separate elements.
529	513	1	Simple	Property/Data-property/Data-value/Categorical-value/Categorical-judgment-value/Simple	Easily understood or presenting no difficulties.
530	513	1	Symmetrical	Property/Data-property/Data-value/Categorical-value/Categorical-judgment-value/Symmetrical	Made up of exactly similar parts facing each other or around an axis. Showing aspects of symmetry.
531	513	1	Unconstrained	Property/Data-property/Data-value/Categorical-value/Categorical-judgment-value/Unconstrained	Moving without restriction.
532	513	1	Unfamiliar	Property/Data-property/Data-value/Categorical-value/Categorical-judgment-value/Unfamiliar	Not having knowledge or experience of.
533	513	1	Unmasked	Property/Data-property/Data-value/Categorical-value/Categorical-judgment-value/Unmasked	Information is revealed.
534	513	1	Voluntary	Property/Data-property/Data-value/Categorical-value/Categorical-judgment-value/Voluntary	Using free will or design; not forced or compelled; controlled by individual volition.
535	500	1	Categorical-level-value	Property/Data-property/Data-value/Categorical-value/Categorical-level-value	Categorical values based on dividing a continuous variable into levels such as high and low.
536	535	1	Cold	Property/Data-property/Data-value/Categorical-value/Categorical-level-value/Cold	Having an absence of heat.
537	535	1	Deep	Property/Data-property/Data-value/Categorical-value/Categorical-level-value/Deep	Extending relatively far inward or downward.
538	535	1	High	Property/Data-property/Data-value/Categorical-value/Categorical-level-value/High	Having a greater than normal degree, intensity, or amount.
539	535	1	Hot	Property/Data-property/Data-value/Categorical-value/Categorical-level-value/Hot	Having an excess of heat.
540	535	1	Large	Property/Data-property/Data-value/Categorical-value/Categorical-level-value/Large	Having a great extent such as in physical dimensions, period of time, amplitude or frequency.
541	535	1	Liminal	Property/Data-property/Data-value/Categorical-value/Categorical-level-value/Liminal	Situated at a sensory threshold that is barely perceptible or capable of eliciting a response.
542	535	1	Loud	Property/Data-property/Data-value/Categorical-value/Categorical-level-value/Loud	Having a perceived high intensity of sound.
543	535	1	Low	Property/Data-property/Data-value/Categorical-value/Categorical-level-value/Low	Less than normal in degree, intensity or amount.
544	535	1	Medium	Property/Data-property/Data-value/Categorical-value/Categorical-level-value/Medium	Mid-way between small and large in number, quantity, magnitude or extent.
545	535	1	Negative	Property/Data-property/Data-value/Categorical-value/Categorical-level-value/Negative	Involving disadvantage or harm.
546	535	1	Positive	Property/Data-property/Data-value/Categorical-value/Categorical-level-value/Positive	Involving advantage or good.
547	535	1	Quiet	Property/Data-property/Data-value/Categorical-value/Categorical-level-value/Quiet	Characterizing a perceived low intensity of sound.
548	535	1	Rough	Property/Data-property/Data-value/Categorical-value/Categorical-level-value/Rough	Having a surface with perceptible bumps, ridges, or irregularities.
549	535	1	Shallow	Property/Data-property/Data-value/Categorical-value/Categorical-level-value/Shallow	Having a depth which is relatively low.
550	535	1	Small	Property/Data-property/Data-value/Categorical-value/Categorical-level-value/Small	Having a small extent such as in physical dimensions, period of time, amplitude or frequency.
551	535	1	Smooth	Property/Data-property/Data-value/Categorical-value/Categorical-level-value/Smooth	Having a surface free from bumps, ridges, or irregularities.
552	535	1	Subliminal	Property/Data-property/Data-value/Categorical-value/Categorical-level-value/Subliminal	Situated below a sensory threshold that is imperceptible or not capable of eliciting a response.
553	535	1	Supraliminal	Property/Data-property/Data-value/Categorical-value/Categorical-level-value/Supraliminal	Situated above a sensory threshold that is perceptible or capable of eliciting a response.
554	535	1	Thick	Property/Data-property/Data-value/Categorical-value/Categorical-level-value/Thick	Wide in width, extent or cross-section.
555	535	1	Thin	Property/Data-property/Data-value/Categorical-value/Categorical-level-value/Thin	Narrow in width, extent or cross-section.
556	500	1	Categorical-orientation-value	Property/Data-property/Data-value/Categorical-value/Categorical-orientation-value	Value indicating the orientation or direction of something.
557	556	1	Backward	Property/Data-property/Data-value/Categorical-value/Categorical-orientation-value/Backward	Directed behind or to the rear.
558	556	1	Downward	Property/Data-property/Data-value/Categorical-value/Categorical-orientation-value/Downward	Moving or leading toward a lower place or level.
559	556	1	Forward	Property/Data-property/Data-value/Categorical-value/Categorical-orientation-value/Forward	At or near or directed toward the front.
560	556	1	Horizontally-oriented	Property/Data-property/Data-value/Categorical-value/Categorical-orientation-value/Horizontally-oriented	Oriented parallel to or in the plane of the horizon.
561	556	1	Leftward	Property/Data-property/Data-value/Categorical-value/Categorical-orientation-value/Leftward	Going toward or facing the left.
562	556	1	Oblique	Property/Data-property/Data-value/Categorical-value/Categorical-orientation-value/Oblique	Slanting or inclined in direction, course, or position that is neither parallel nor perpendicular nor right-angular.
563	556	1	Rightward	Property/Data-property/Data-value/Categorical-value/Categorical-orientation-value/Rightward	Going toward or situated on the right.
564	556	1	Rotated	Property/Data-property/Data-value/Categorical-value/Categorical-orientation-value/Rotated	Positioned offset around an axis or center.
565	556	1	Upward	Property/Data-property/Data-value/Categorical-value/Categorical-orientation-value/Upward	Moving, pointing, or leading to a higher place, point, or level.
566	556	1	Vertically-oriented	Property/Data-property/Data-value/Categorical-value/Categorical-orientation-value/Vertically-oriented	Oriented perpendicular to the plane of the horizon.
567	499	1	Physical-value	Property/Data-property/Data-value/Physical-value	The value of some physical property of something.
568	567	1	Weight	Property/Data-property/Data-value/Physical-value/Weight	The relative mass or the quantity of matter contained by something.
569	567	1	Temperature	Property/Data-property/Data-value/Physical-value/Temperature	A measure of hot or cold based on the average kinetic energy of the atoms or molecules in the system.
570	499	1	Quantitative-value	Property/Data-property/Data-value/Quantitative-value	Something capable of being estimated or expressed with numeric values.
571	570	1	Fraction	Property/Data-property/Data-value/Quantitative-value/Fraction	A numerical value between 0 and 1.
572	570	1	Item-count	Property/Data-property/Data-value/Quantitative-value/Item-count	The integer count of something which is usually grouped with the entity it is counting. (Item-count/3, A) indicates that 3 of A have occurred up to this point.
573	570	1	Item-index	Property/Data-property/Data-value/Quantitative-value/Item-index	The index of an item in a collection, sequence or other structure. (A (Item-index/3, B)) means that A is item number 3 in B.
574	570	1	Item-interval	Property/Data-property/Data-value/Quantitative-value/Item-interval	An integer indicating how many items or entities have passed since the last one of these. An item interval of 0 indicates the current item.
575	570	1	Percentage	Property/Data-property/Data-value/Quantitative-value/Percentage	A fraction or ratio with 100 understood as the denominator.
576	570	1	Ratio	Property/Data-property/Data-value/Quantitative-value/Ratio	A quotient of quantities of the same kind for different components within the same system.
577	499	1	Statistical-value	Property/Data-property/Data-value/Statistical-value	A value based on or employing the principles of statistics.
578	577	1	Data-maximum	Property/Data-property/Data-value/Statistical-value/Data-maximum	The largest possible quantity or degree.
579	577	1	Data-mean	Property/Data-property/Data-value/Statistical-value/Data-mean	The sum of a set of values divided by the number of values in the set.
580	577	1	Data-median	Property/Data-property/Data-value/Statistical-value/Data-median	The value which has an equal number of values greater and less than it.
581	577	1	Data-minimum	Property/Data-property/Data-value/Statistical-value/Data-minimum	The smallest possible quantity.
582	577	1	Probability	Property/Data-property/Data-value/Statistical-value/Probability	A measure of the expectation of the occurrence of a particular event.
583	577	1	Standard-deviation	Property/Data-property/Data-value/Statistical-value/Standard-deviation	A measure of the range of values in a set of numbers. Standard deviation is a statistic used as a measure of the dispersion or variation in a distribution, equal to the square root of the arithmetic mean of the squares of the deviations from the arithmetic mean.
584	577	1	Statistical-accuracy	Property/Data-property/Data-value/Statistical-value/Statistical-accuracy	A measure of closeness to true value expressed as a number between 0 and 1.
585	577	1	Statistical-precision	Property/Data-property/Data-value/Statistical-value/Statistical-precision	A quantitative representation of the degree of accuracy necessary for or associated with a particular action.
586	577	1	Statistical-recall	Property/Data-property/Data-value/Statistical-value/Statistical-recall	Sensitivity is a measurement datum qualifying a binary classification test and is computed by substracting the false negative rate to the integral numeral 1.
587	577	1	Statistical-uncertainty	Property/Data-property/Data-value/Statistical-value/Statistical-uncertainty	A measure of the inherent variability of repeated observation measurements of a quantity including quantities evaluated by statistical methods and by other means.
588	499	1	Spatiotemporal-value	Property/Data-property/Data-value/Spatiotemporal-value	A property relating to space and/or time.
589	588	1	Rate-of-change	Property/Data-property/Data-value/Spatiotemporal-value/Rate-of-change	The amount of change accumulated per unit time.
590	589	1	Acceleration	Property/Data-property/Data-value/Spatiotemporal-value/Rate-of-change/Acceleration	Magnitude of the rate of change in either speed or direction. The direction of change should be given separately.
591	589	1	Frequency	Property/Data-property/Data-value/Spatiotemporal-value/Rate-of-change/Frequency	Frequency is the number of occurrences of a repeating event per unit time.
592	589	1	Jerk-rate	Property/Data-property/Data-value/Spatiotemporal-value/Rate-of-change/Jerk-rate	Magnitude of the rate at which the acceleration of an object changes with respect to time. The direction of change should be given separately.
593	589	1	Sampling-rate	Property/Data-property/Data-value/Spatiotemporal-value/Rate-of-change/Sampling-rate	The number of digital samples taken or recorded per unit of time.
594	589	1	Refresh-rate	Property/Data-property/Data-value/Spatiotemporal-value/Rate-of-change/Refresh-rate	The frequency with which the image on a computer monitor or similar electronic display screen is refreshed, usually expressed in hertz.
595	589	1	Speed	Property/Data-property/Data-value/Spatiotemporal-value/Rate-of-change/Speed	A scalar measure of the rate of movement of the object expressed either as the distance travelled divided by the time taken (average speed) or the rate of change of position with respect to time at a particular point (instantaneous speed). The direction of change should be given separately.
596	589	1	Temporal-rate	Property/Data-property/Data-value/Spatiotemporal-value/Rate-of-change/Temporal-rate	The number of items per unit of time.
597	588	1	Spatial-value	Property/Data-property/Data-value/Spatiotemporal-value/Spatial-value	Value of an item involving space.
598	597	1	Angle	Property/Data-property/Data-value/Spatiotemporal-value/Spatial-value/Angle	The amount of inclination of one line to another or the plane of one object to another.
599	597	1	Distance	Property/Data-property/Data-value/Spatiotemporal-value/Spatial-value/Distance	A measure of the space separating two objects or points.
600	597	1	Position	Property/Data-property/Data-value/Spatiotemporal-value/Spatial-value/Position	A reference to the alignment of an object, a particular situation or view of a situation, or the location of an object. Coordinates with respect a specified frame of reference or the default Screen-frame if no frame is given.
601	600	1	X-position	Property/Data-property/Data-value/Spatiotemporal-value/Spatial-value/Position/X-position	The position along the x-axis of the frame of reference.
602	600	1	Y-position	Property/Data-property/Data-value/Spatiotemporal-value/Spatial-value/Position/Y-position	The position along the y-axis of the frame of reference.
603	600	1	Z-position	Property/Data-property/Data-value/Spatiotemporal-value/Spatial-value/Position/Z-position	The position along the z-axis of the frame of reference.
604	597	1	Size	Property/Data-property/Data-value/Spatiotemporal-value/Spatial-value/Size	The physical magnitude of something.
605	604	1	Area	Property/Data-property/Data-value/Spatiotemporal-value/Spatial-value/Size/Area	The extent of a 2-dimensional surface enclosed within a boundary.
606	604	1	Depth	Property/Data-property/Data-value/Spatiotemporal-value/Spatial-value/Size/Depth	The distance from the surface of something especially from the perspective of looking from the front.
607	604	1	Length	Property/Data-property/Data-value/Spatiotemporal-value/Spatial-value/Size/Length	The linear extent in space from one end of something to the other end, or the extent of something from beginning to end.
608	604	1	Width	Property/Data-property/Data-value/Spatiotemporal-value/Spatial-value/Size/Width	The extent or measurement of something from side to side.
609	604	1	Height	Property/Data-property/Data-value/Spatiotemporal-value/Spatial-value/Size/Height	The vertical measurement or distance from the base to the top of an object.
610	604	1	Volume	Property/Data-property/Data-value/Spatiotemporal-value/Spatial-value/Size/Volume	The amount of three dimensional space occupied by an object or the capacity of a space or container.
611	588	1	Temporal-value	Property/Data-property/Data-value/Spatiotemporal-value/Temporal-value	A characteristic of or relating to time or limited by time.
612	611	1	Delay	Property/Data-property/Data-value/Spatiotemporal-value/Temporal-value/Delay	Time during which some action is awaited.
613	611	1	Duration	Property/Data-property/Data-value/Spatiotemporal-value/Temporal-value/Duration	The period of time during which something occurs or continues.
614	611	1	Time-interval	Property/Data-property/Data-value/Spatiotemporal-value/Temporal-value/Time-interval	The period of time separating two instances, events, or occurrences.
615	611	1	Time-value	Property/Data-property/Data-value/Spatiotemporal-value/Temporal-value/Time-value	A value with units of time. Usually grouped with tags identifying what the value represents.
616	477	1	Data-variability-attribute	Property/Data-property/Data-variability-attribute	An attribute describing how something changes or varies.
617	616	1	Abrupt	Property/Data-property/Data-variability-attribute/Abrupt	Marked by sudden change.
618	616	1	Constant	Property/Data-property/Data-variability-attribute/Constant	Continually recurring or continuing without interruption. Not changing in time or space.
619	616	1	Continuous	Property/Data-property/Data-variability-attribute/Continuous	Uninterrupted in time, sequence, substance, or extent.
620	616	1	Decreasing	Property/Data-property/Data-variability-attribute/Decreasing	Becoming smaller or fewer in size, amount, intensity, or degree.
621	616	1	Deterministic	Property/Data-property/Data-variability-attribute/Deterministic	No randomness is involved in the development of the future states of the element.
622	616	1	Discontinuous	Property/Data-property/Data-variability-attribute/Discontinuous	Having a gap in time, sequence, substance, or extent.
623	616	1	Discrete	Property/Data-property/Data-variability-attribute/Discrete	Constituting a separate entities or parts.
624	616	1	Flickering	Property/Data-property/Data-variability-attribute/Flickering	Moving irregularly or unsteadily or burning or shining fitfully or with a fluctuating light.
625	616	1	Estimated-value	Property/Data-property/Data-variability-attribute/Estimated-value	Something that has been calculated or measured approximately.
626	616	1	Exact-value	Property/Data-property/Data-variability-attribute/Exact-value	A value that is viewed to the true value according to some standard.
627	616	1	Fractal	Property/Data-property/Data-variability-attribute/Fractal	Having extremely irregular curves or shapes for which any suitably chosen part is similar in shape to a given larger or smaller part when magnified or reduced to the same size.
628	616	1	Increasing	Property/Data-property/Data-variability-attribute/Increasing	Becoming greater in size, amount, or degree.
629	616	1	Random	Property/Data-property/Data-variability-attribute/Random	Governed by or depending on chance. Lacking any definite plan or order or purpose.
630	616	1	Repetitive	Property/Data-property/Data-variability-attribute/Repetitive	A recurring action that is often non-purposeful.
631	616	1	Stochastic	Property/Data-property/Data-variability-attribute/Stochastic	Uses  a random probability distribution or pattern that may be analysed statistically but may not be predicted precisely to determine future states.
632	616	1	Varying	Property/Data-property/Data-variability-attribute/Varying	Differing in size, amount, degree, or nature.
633	401	1	Environmental-property	Property/Environmental-property	Relating to or arising from the surroundings of an agent.
634	633	1	Indoors	Property/Environmental-property/Indoors	Located inside a building or enclosure.
635	633	1	Outdoors	Property/Environmental-property/Outdoors	Any area outside a building or shelter.
636	633	1	Real-world	Property/Environmental-property/Real-world	Located in a place that exists in real space and time under realistic conditions.
637	633	1	Virtual-world	Property/Environmental-property/Virtual-world	Using technology that creates immersive, computer-generated experiences that a person can interact with and navigate through. The digital content is generally delivered to the user through some type of headset and responds to changes in head position or through interaction with other types of sensors. Existing in a virtual setting such as a simulation or game environment.
638	633	1	Augmented-reality	Property/Environmental-property/Augmented-reality	Using technology that enhances real-world experiences with computer-derived digital overlays to change some aspects of perception of the natural environment. The digital content is shown to the user through a smart device or glasses and responds to changes in the environment.
639	633	1	Motion-platform	Property/Environmental-property/Motion-platform	A mechanism that creates the feelings of being in a real motion environment.
640	633	1	Urban	Property/Environmental-property/Urban	Relating to, located in, or characteristic of a city or densely populated area.
641	633	1	Rural	Property/Environmental-property/Rural	Of or pertaining to the country as opposed to the city.
642	633	1	Terrain	Property/Environmental-property/Terrain	Characterization of the physical features of a tract of land.
643	642	1	Composite-terrain	Property/Environmental-property/Terrain/Composite-terrain	Tracts of land characterized by a mixure of physical features.
644	642	1	Dirt-terrain	Property/Environmental-property/Terrain/Dirt-terrain	Tracts of land characterized by a soil surface and lack of vegetation.
645	642	1	Grassy-terrain	Property/Environmental-property/Terrain/Grassy-terrain	Tracts of land covered by grass.
646	642	1	Gravel-terrain	Property/Environmental-property/Terrain/Gravel-terrain	Tracts of land covered by a surface consisting a loose aggregation of small water-worn or pounded stones.
647	642	1	Leaf-covered-terrain	Property/Environmental-property/Terrain/Leaf-covered-terrain	Tracts of land covered by leaves and composited organic material.
648	642	1	Muddy-terrain	Property/Environmental-property/Terrain/Muddy-terrain	Tracts of land covered by a liquid or semi-liquid mixture of water and some combination of soil, silt, and clay.
649	642	1	Paved-terrain	Property/Environmental-property/Terrain/Paved-terrain	Tracts of land covered  with concrete, asphalt, stones, or bricks.
650	642	1	Rocky-terrain	Property/Environmental-property/Terrain/Rocky-terrain	Tracts of land consisting or full of rock or rocks.
651	642	1	Sloped-terrain	Property/Environmental-property/Terrain/Sloped-terrain	Tracts of land arranged in a sloping  or inclined position.
652	642	1	Uneven-terrain	Property/Environmental-property/Terrain/Uneven-terrain	Tracts of land that are not level, smooth, or regular.
653	401	1	Informational-property	Property/Informational-property	Something that pertains to a task.
654	653	1	Description	Property/Informational-property/Description	An explanation of what the tag group it is in means. If the description is at the top-level of an event string, the description applies to the event.
655	653	1	ID	Property/Informational-property/ID	An alphanumeric name that identifies either a unique object or a unique class of objects. Here the object or class may be an idea, physical countable object (or class), or physical uncountable substance (or class).
656	653	1	Label	Property/Informational-property/Label	A string of 20 or fewer characters identifying something. Labels usually refer to general classes of things while IDs refer to specific instances. A term that is associated with some entity. A brief description given for purposes of identification. An identifying or descriptive marker that is attached to an object.
657	653	1	Metadata	Property/Informational-property/Metadata	Data about data. Information that describes another set of data.
658	657	1	CogAtlas	Property/Informational-property/Metadata/CogAtlas	The Cognitive Atlas ID number of something.
659	657	1	CogPo	Property/Informational-property/Metadata/CogPo	The CogPO ID number of something.
660	657	1	Creation-date	Property/Informational-property/Metadata/Creation-date	The date on which data creation of this element began.
661	657	1	Experimental-note	Property/Informational-property/Metadata/Experimental-note	A brief written record about the experiment.
662	657	1	Library-name	Property/Informational-property/Metadata/Library-name	Official name of a HED library.
663	657	1	OBO-identifier	Property/Informational-property/Metadata/OBO-identifier	The identifier of a term in some Open Biology Ontology (OBO) ontology.
664	657	1	Pathname	Property/Informational-property/Metadata/Pathname	The specification of a node (file or directory) in a hierarchical file system, usually specified by listing the nodes top-down.
665	657	1	Subject-identifier	Property/Informational-property/Metadata/Subject-identifier	A sequence of characters used to identify, name, or characterize a trial or study subject.
666	657	1	Version-identifier	Property/Informational-property/Metadata/Version-identifier	An alphanumeric character string that identifies a form or variant of a type or original.
667	653	1	Parameter	Property/Informational-property/Parameter	Something user-defined for this experiment.
668	667	1	Parameter-label	Property/Informational-property/Parameter/Parameter-label	The name of the parameter.
669	667	1	Parameter-value	Property/Informational-property/Parameter/Parameter-value	The value of the parameter.
670	401	1	Organizational-property	Property/Organizational-property	Relating to an organization or the action of organizing something.
671	670	1	Collection	Property/Organizational-property/Collection	A tag designating a grouping of items such as in a set or list.
672	670	1	Condition-variable	Property/Organizational-property/Condition-variable	An aspect of the experiment or task that is to be varied during the experiment. Task-conditions are sometimes called independent variables or contrasts.
673	670	1	Control-variable	Property/Organizational-property/Control-variable	An aspect of the experiment that is fixed throughout the study and usually is explicitly controlled.
674	670	1	Def	Property/Organizational-property/Def	A HED-specific utility tag used with a defined name to represent the tags associated with that definition.
675	670	1	Def-expand	Property/Organizational-property/Def-expand	A HED specific utility tag that is grouped with an expanded definition. The child value of the Def-expand is the name of the expanded definition.
676	670	1	Definition	Property/Organizational-property/Definition	A HED-specific utility tag whose child value is the name of the concept and the tag group associated with the tag is an English language explanation of a concept.
